timestamp_utc,task_id,cwd,repo,command,output_path,exit_code,redaction,notes
2026-07-12T21:25:33Z,CDB050,/home/flexnetos/meta/src/nu_plugin,FlexNetOS/nu_plugin,python3 -m unittest tests.test_runtime_tool_contract and Nix runtime smoke and active frontdoor checks,logs/CDB050-runtime-tool.log,0,no raw secrets recorded,Three tests Nix smoke codedb 0.1.0 and executable Nu plugin frontdoor passed without profile mutation.
2026-07-12T22:42:14Z,CDB041,/home/flexnetos/meta/src/nu_plugin,FlexNetOS/nu_plugin,Bun primary-registry latest recheck frozen install import smoke and full CodeDB online Node capture,logs/CDB041-online-node-source.log,0,no raw secrets recorded,Ten first-party latest versions match the lock; 20381 exact blobs and 81182690 bytes plus 27 checksum-bound Bun .bin symlinks captured; zero capture gaps; representative symlink replay passed.
2026-07-12T22:42:14Z,CDB046,/home/flexnetos/meta/src/nu_plugin,FlexNetOS/nu_plugin,fmt deny-warnings clippy workspace Rust Python Nu doctor PostgreSQL and task-structure validation,logs/CDB046-validation.log,0,no raw secrets recorded,Rust workspace green; 88 Python tests; 15 Nu scripts; 13 live PostgreSQL cases; all doctor scopes explicit.
2026-07-12T22:42:14Z,CDB077,/home/flexnetos/meta/src/nu_plugin,FlexNetOS/nu_plugin,cargo test compiler production CLI and codedb-rust-static evidence suites,logs/compiler-observed/SUMMARY.json,0,no raw secrets recorded,Compiler expansion hygiene HIR MIR rustdoc pins drift semantics refusal and source immutability proven.
2026-07-12T22:42:14Z,CDB078,/home/flexnetos/meta/src/nu_plugin,FlexNetOS/nu_plugin,cargo test build capture production CLI and approved frontdoor suites,logs/CDB078-proc-macro-gate.log,0,no raw secrets recorded,Proc-macro build-script OUT_DIR reproduction and native-link approval provenance proven through production frontdoors.
2026-07-12T22:42:14Z,CDB081,/home/flexnetos/meta/src/nu_plugin,FlexNetOS/nu_plugin,cargo test -p codedb-core --test materialization_paths,logs/CDB081-symlink-platform-materialization.log,0,no raw secrets recorded,Ten descriptor-relative no-follow durable no-replace symlink and fallback cases passed.
2026-07-12T22:42:14Z,CDB083,/home/flexnetos/meta/src/nu_plugin,FlexNetOS/nu_plugin,cargo MCP tests and Nu no-leak protocol suite,logs/CDB083-mcp-raw-source-block.log,0,no raw secrets recorded,Raw source and blob reads remain bounded denied and sentinel-safe.
2026-07-12T22:42:14Z,CDB086,/home/flexnetos/meta/src/nu_plugin,FlexNetOS/nu_plugin,disposable PostgreSQL 16.14 blobstore migration rollback parity,logs/receipts/cdb086-live-pg-stdout.log,0,no raw secrets recorded,All 13 live PostgreSQL parity cases passed and the temporary service was removed.
2026-07-12T22:42:14Z,REQ-061,/home/flexnetos/meta/src/nu_plugin,FlexNetOS/nu_plugin,cargo test envctl db_docs_contract,external:../envctl/crates/cli/tests/db_docs_contract.rs,0,no raw secrets recorded,Two direct tests prove the Meta LifeOS multi-root documentation and every current CLI example.
2026-07-12T22:42:14Z,CDB050,/home/flexnetos/meta/src/nu_plugin,FlexNetOS/nu_plugin,current-tree Nix codedb runtime-tool smoke with wrapped Bubblewrap,logs/CDB050-runtime-tool.log,0,no raw secrets recorded,Current derivation passed at /nix/store/f46gq7wvm6y7izaxriz313hihr0jnx7h-codedb-runtime-tool-smoke.
2026-07-12T22:42:14Z,CDB090,/home/flexnetos/meta/src/nu_plugin,FlexNetOS/nu_plugin,direct requirement-proof and bidirectional-package validators,logs/CDB047-manifest.log,0,no raw secrets recorded,140/140 direct requirement rows and 21/21 bidirectional task rows passed; detached clean-tree receipt remains mandatory for release.
