timestamp_utc,task_id,cwd,repo,command,output_path,exit_code,redaction,notes
2026-07-02T01:02:12.731033+00:00,CDB064,/mnt/data/nu_plugin_codedb_build_workspace/extracted/nu_plugin_codedb_execution_pack_v1_1,nu_plugin_codedb_execution_pack_v1_1,verify source ZIP extraction gate,manifests/EXTRACTION_PROOF.json;logs/CDB064-extraction-proof.log,0,no raw secrets recorded,Confirmed extracted files exist before package construction.
2026-07-02T01:02:12.749276+00:00,CDB006,/mnt/data/nu_plugin_codedb_build_workspace/extracted/nu_plugin_codedb_execution_pack_v1_1,nu_plugin_codedb_execution_pack_v1_1,create documentation artifacts for CDB006,docs/ARCHITECTURE.md;logs/CDB006-architecture.log,0,no raw secrets recorded,Generated execution-package documentation from canonical PRD.
2026-07-02T01:02:12.751294+00:00,CDB007,/mnt/data/nu_plugin_codedb_build_workspace/extracted/nu_plugin_codedb_execution_pack_v1_1,nu_plugin_codedb_execution_pack_v1_1,create documentation artifacts for CDB007,docs/SCHEMA.md;logs/CDB007-schema.log,0,no raw secrets recorded,Generated execution-package documentation from canonical PRD.
2026-07-02T01:02:12.753719+00:00,CDB008,/mnt/data/nu_plugin_codedb_build_workspace/extracted/nu_plugin_codedb_execution_pack_v1_1,nu_plugin_codedb_execution_pack_v1_1,create documentation artifacts for CDB008,docs/COMMANDS.md;logs/CDB008-commands.log,0,no raw secrets recorded,Generated execution-package documentation from canonical PRD.
2026-07-02T01:02:12.755401+00:00,CDB009,/mnt/data/nu_plugin_codedb_build_workspace/extracted/nu_plugin_codedb_execution_pack_v1_1,nu_plugin_codedb_execution_pack_v1_1,create documentation artifacts for CDB009,docs/INTEGRATION_CONTRACTS.md;logs/CDB009-integration.log,0,no raw secrets recorded,Generated execution-package documentation from canonical PRD.
2026-07-02T01:02:12.756935+00:00,CDB010,/mnt/data/nu_plugin_codedb_build_workspace/extracted/nu_plugin_codedb_execution_pack_v1_1,nu_plugin_codedb_execution_pack_v1_1,create documentation artifacts for CDB010,docs/SECURITY_AND_SECRET_POLICY.md;docs/UNSAFE_CAPTURE_POLICY.md;logs/CDB010-security.log,0,no raw secrets recorded,Generated execution-package documentation from canonical PRD.
2026-07-02T01:02:12.758573+00:00,CDB011,/mnt/data/nu_plugin_codedb_build_workspace/extracted/nu_plugin_codedb_execution_pack_v1_1,nu_plugin_codedb_execution_pack_v1_1,create documentation artifacts for CDB011,docs/CODEX_BRIDGE.md;docs/NUSHELL_PLUGIN_COMPAT.md;docs/YAZELIX_PLACEMENT.md;logs/CDB011-bridge.log,0,no raw secrets recorded,Generated execution-package documentation from canonical PRD.
2026-07-02T01:02:12.760471+00:00,CDB012,/mnt/data/nu_plugin_codedb_build_workspace/extracted/nu_plugin_codedb_execution_pack_v1_1,nu_plugin_codedb_execution_pack_v1_1,create documentation artifacts for CDB012,docs/TEST_PLAN.md;docs/FIXTURE_MATRIX.md;logs/CDB012-tests-docs.log,0,no raw secrets recorded,Generated execution-package documentation from canonical PRD.
2026-07-02T01:02:12.780652+00:00,CDB065,/mnt/data/nu_plugin_codedb_build_workspace/extracted/nu_plugin_codedb_execution_pack_v1_1,nu_plugin_codedb_execution_pack_v1_1,augment TASK_GRAPH.csv and create TASK_GRAPH.md,execution/TASK_GRAPH.csv;execution/TASK_GRAPH.md;logs/CDB065-task-graph-final.log,0,no raw secrets recorded,"Added required controlled-execution columns, CDB064-CDB067, and Markdown projection."
2026-07-02T01:02:12.786455+00:00,CDB066,/mnt/data/nu_plugin_codedb_build_workspace/extracted/nu_plugin_codedb_execution_pack_v1_1,nu_plugin_codedb_execution_pack_v1_1,create checklist completion evidence map,CHECKLIST_COMPLETION.md;manifests/CHECKLIST_COMPLETION.json;logs/CDB066-checklist-completion.log,0,no raw secrets recorded,Mapped every checklist checkbox to a completed artifact or controlled task-graph gate.
2026-07-02T01:02:13.053614+00:00,CDB067,/mnt/data/nu_plugin_codedb_build_workspace/extracted/nu_plugin_codedb_execution_pack_v1_1,nu_plugin_codedb_execution_pack_v1_1,validate and seal final execution package,manifests/PACKAGE_VALIDATION.json;manifests/PACK_MANIFEST.json;manifests/CHECKSUMS.sha256;logs/CDB067-final-validation.log,0,no raw secrets recorded,"Validated links, task graph DAG, checklist mapping, checksums, required files, and secret hygiene."
2026-07-02T01:02:55.125146+00:00,CDB067,/mnt/data/nu_plugin_codedb_build_workspace/extracted/nu_plugin_codedb_execution_pack_v1_1,nu_plugin_codedb_execution_pack_v1_1,final reseal after ledger/worklog/log updates,manifests/PACK_MANIFEST.json;manifests/CHECKSUMS.sha256;manifests/PACKAGE_VALIDATION.json,0,no raw secrets recorded,Recomputed manifest/checksums after all mutable evidence files were finalized.
2026-07-02T01:44:15Z,CDB068,/mnt/data/nu_plugin_codedb_final_execution_package_csv_sot_repaired,nu_plugin_codedb_final_execution_package,repair TASK_GRAPH.csv source-of-truth path linkage from csv_doc_link_audit.md,execution/TASK_GRAPH.csv;execution/TASK_GRAPH.md;execution/TASK_FILE_MAP.csv;manifests/CSV_SOURCE_OF_TRUTH_REPAIR.json;logs/CDB000-package-init.log;logs/CDB001-navigation.log;logs/CDB002-gates.log;logs/CDB003-task-graph.log;logs/CDB004-ledger.log;logs/CDB005-manifest.log;logs/CDB068-csv-source-of-truth-repair.log,0,no raw secrets recorded,Surgical CSV/package repair; no Rust implementation rows marked complete.
2026-07-02T15:45:00Z,CDB069,/home/flexnetos/FlexNetOS/src/nu_plugin-next-worktree,FlexNetOS/nu_plugin,complete post-audit upgrade hardening without downgrades,docs/AUDIT_UPGRADE_COMPLETION.md;.github/workflows/ci.yml;flake.nix;Cargo.toml;Cargo.lock;NAVIGATION.md;NAVIGATION.json;DOC_GRAPH.md;execution/TASK_GRAPH.csv;execution/TASK_GRAPH.md;execution/TASK_FILE_MAP.csv;logs/CDB069-audit-upgrade-completion.log,0,no raw secrets recorded,Added supported CI shell and Nu smoke lane; documented Git repo authority over stale Downloads package; preserved remaining product gaps as forward work.
2026-07-02T17:50:43Z,CDB070,/home/flexnetos/FlexNetOS/src/nu_plugin-next-worktree,FlexNetOS/nu_plugin,create bidirectional roadmap package from issue 212,docs/BIDIRECTIONAL_ROADMAP.md;docs/BIDIRECTIONAL_ARCHITECTURE.md;docs/ROUND_TRIP_PROOF.md;docs/CHANGE_PLAN_SCHEMA.md;docs/MUTATION_POLICY.md;docs/GAP_CLOSURE_PLAN.md;execution/BIDIRECTIONAL_TASK_GRAPH.csv;execution/BIDIRECTIONAL_TASK_FILE_MAP.csv;scripts/validate_bidirectional_package.py,0,no raw secrets recorded,Loaded CDB070-CDB090 into GitKB and created the source roadmap package with read-only defaults preserved.
2026-07-02T17:50:43Z,CDB071,/home/flexnetos/FlexNetOS/src/nu_plugin-next-worktree,FlexNetOS/nu_plugin,prove read-only bidirectional defaults in CLI Nu plugin and MCP,crates/codedb/src/main.rs;crates/nu_plugin_codedb/src/main.rs;crates/codedb_mcp/src/lib.rs;execution/BIDIRECTIONAL_TASK_GRAPH.csv;logs/CDB071-read-only-foundation.log,0,no raw secrets recorded,Added focused tests proving no default apply/patch/source-overwrite/git-mutation/sync-bidirectional command surfaces and MCP raw/mutating tools remain blocked.
2026-07-02T17:56:53Z,CDB070,/home/flexnetos/FlexNetOS/src/nu_plugin-next-worktree,FlexNetOS/nu_plugin,close GitKB evidence audit task after synced validation,.kb/workspaces/nu_plugin-next-worktree/tasks/cdb070-bidirectional-phase-0-evidence-audit.md;execution/BIDIRECTIONAL_TASK_GRAPH.csv;execution/WORKLOG.md;execution/COMMAND_LEDGER.csv,0,no raw secrets recorded,Validated bidirectional package and truth surface before marking CDB070 complete.
2026-07-02T17:56:53Z,CDB072,/home/flexnetos/FlexNetOS/src/nu_plugin-next-worktree,FlexNetOS/nu_plugin,implement lossless artifact metadata and round-trip fixtures,crates/codedb_store_redb/src/lib.rs;flake.nix;docs/ROUND_TRIP_PROOF.md;docs/GAP_CLOSURE_PLAN.md;docs/BIDIRECTIONAL_ARCHITECTURE.md;execution/BIDIRECTIONAL_TASK_GRAPH.csv;logs/CDB072-round-trip-artifacts.log,0,no raw secrets recorded,Added exact-byte non-Rust binary fixture Unix executable-bit restoration fixture and runnable clippy gate.
2026-07-02T18:02:33Z,CDB073,/home/flexnetos/FlexNetOS/src/nu_plugin-next-worktree,FlexNetOS/nu_plugin,implement reviewable change-plan graph and drift conflict proof,crates/codedb_core/src/lib.rs;docs/CHANGE_PLAN_SCHEMA.md;execution/BIDIRECTIONAL_TASK_GRAPH.csv;logs/CDB073-change-plan-graph.log,0,no raw secrets recorded,Added no-apply change-plan row projection and source snapshot drift conflict tests.
2026-07-02T18:05:03Z,CDB074,/home/flexnetos/FlexNetOS/src/nu_plugin-next-worktree,FlexNetOS/nu_plugin,implement isolated worktree patch artifact guard,crates/codedb_core/src/lib.rs;docs/ROUND_TRIP_PROOF.md;docs/MUTATION_POLICY.md;execution/BIDIRECTIONAL_TASK_GRAPH.csv;logs/CDB074-isolated-worktree-patches.log,0,no raw secrets recorded,Added guarded patch artifact writer that refuses source checkout targets and requires proof gates.
2026-07-02T18:09:07Z,CDB075,/home/flexnetos/FlexNetOS/src/nu_plugin-next-worktree,FlexNetOS/nu_plugin,implement operator-approved apply gate validation,crates/codedb_core/src/lib.rs;docs/CHANGE_PLAN_SCHEMA.md;docs/MUTATION_POLICY.md;execution/BIDIRECTIONAL_TASK_GRAPH.csv;logs/CDB075-apply-gate.log,0,no raw secrets recorded,Added apply-gate validator requiring approval provenance stop proof manual decision source stability and recovery refs.
2026-07-02T18:11:30Z,CDB076,/home/flexnetos/FlexNetOS/src/nu_plugin-next-worktree,FlexNetOS/nu_plugin,implement bidirectional sync verification semantics,crates/codedb_core/src/lib.rs;docs/BIDIRECTIONAL_ARCHITECTURE.md;docs/CHANGE_PLAN_SCHEMA.md;execution/BIDIRECTIONAL_TASK_GRAPH.csv;logs/CDB076-sync-semantics.log,0,no raw secrets recorded,Added sync evaluator for source drift conflicts final rescan verification and recovery rows.
2026-07-02T18:13:55Z,CDB077,/home/flexnetos/FlexNetOS/src/nu_plugin-next-worktree,FlexNetOS/nu_plugin,gate compiler-observed macro expansion as explicit gap,crates/codedb_rust_static/src/lib.rs;docs/GAP_CLOSURE_PLAN.md;execution/BIDIRECTIONAL_TASK_GRAPH.csv;logs/CDB077-macro-expansion-gate.log,0,no raw secrets recorded,Added macro expansion gate rows with gap status and fixture proof.
2026-07-02T18:16:15Z,CDB078,/home/flexnetos/FlexNetOS/src/nu_plugin-next-worktree,FlexNetOS/nu_plugin,prove proc-macro execution unsafe gate,crates/codedb_build_capture/src/lib.rs;docs/GAP_CLOSURE_PLAN.md;execution/BIDIRECTIONAL_TASK_GRAPH.csv;logs/CDB078-proc-macro-gate.log,0,no raw secrets recorded,Added proc-macro execution refusal gap and approval provenance fixture proof.
2026-07-02T18:18:26Z,CDB079,/home/flexnetos/FlexNetOS/src/nu_plugin-next-worktree,FlexNetOS/nu_plugin,prove build-script execution unsafe gate,crates/codedb_build_capture/src/lib.rs;docs/GAP_CLOSURE_PLAN.md;execution/BIDIRECTIONAL_TASK_GRAPH.csv;logs/CDB079-build-script-gate.log,0,no raw secrets recorded,Added build-script execution refusal and approved log/provenance fixture proof.
2026-07-02T19:26:53Z,CDB080,/home/flexnetos/FlexNetOS/src/nu_plugin-next-worktree,FlexNetOS/nu_plugin,record generated OUT_DIR reproduction gap with required provenance,crates/codedb_build_capture/src/lib.rs;docs/GAP_CLOSURE_PLAN.md;docs/ROUND_TRIP_PROOF.md;execution/BIDIRECTIONAL_TASK_GRAPH.csv;logs/CDB080-out-dir-reproduction.log,0,no raw secrets recorded,Added explicit out_dir_artifacts gap with environment/provenance requirements and focused fixture proof.
2026-07-02T19:30:40Z,CDB081,/home/flexnetos/FlexNetOS/src/nu_plugin-next-worktree,FlexNetOS/nu_plugin,model symlink materialization platform capability and fallback rows,crates/codedb_core/src/lib.rs;docs/GAP_CLOSURE_PLAN.md;docs/ROUND_TRIP_PROOF.md;execution/BIDIRECTIONAL_TASK_GRAPH.csv;logs/CDB081-symlink-platform-materialization.log,0,no raw secrets recorded,Added supported and metadata-only fallback rows for symlink materialization with Unix scan proof.
2026-07-02T19:33:35Z,CDB082,/home/flexnetos/FlexNetOS/src/nu_plugin-next-worktree,FlexNetOS/nu_plugin,capture native linker facts only under approved dynamic build gate,crates/codedb_build_capture/src/lib.rs;crates/codedb_build_capture/Cargo.toml;Cargo.lock;docs/GAP_CLOSURE_PLAN.md;docs/UNSAFE_CAPTURE_POLICY.md;execution/BIDIRECTIONAL_TASK_GRAPH.csv;logs/CDB082-native-linker-facts.log,0,no raw secrets recorded,Parsed Cargo build-script-executed linked_libs and linked_paths into native_link_facts rows with default GAP refusal.
2026-07-02T19:35:45Z,CDB083,/home/flexnetos/FlexNetOS/src/nu_plugin-next-worktree,FlexNetOS/nu_plugin,block MCP raw source and blob aliases with bounded denial rows,crates/codedb_mcp/src/lib.rs;docs/GAP_CLOSURE_PLAN.md;docs/MUTATION_POLICY.md;execution/BIDIRECTIONAL_TASK_GRAPH.csv;logs/CDB083-mcp-raw-source-block.log,0,no raw secrets recorded,Added raw source/blob blocked tool aliases and raw_blob_table_blocked table-page tests.
2026-07-02T19:38:23Z,CDB084,/home/flexnetos/FlexNetOS/src/nu_plugin-next-worktree,FlexNetOS/nu_plugin,stabilize anonymous syntax identity with unstable classification,crates/codedb_rust_static/src/lib.rs;docs/GAP_CLOSURE_PLAN.md;docs/CHANGE_PLAN_SCHEMA.md;execution/BIDIRECTIONAL_TASK_GRAPH.csv;logs/CDB084-anonymous-identity.log,0,no raw secrets recorded,Added stable_named and unstable_anonymous identity rows with repeat-scan fixture proof.
2026-07-02T19:42:40Z,CDB085,/home/flexnetos/FlexNetOS/src/nu_plugin-next-worktree,FlexNetOS/nu_plugin,add semantic and public API hash reports,crates/codedb_rust_static/src/lib.rs;docs/GAP_CLOSURE_PLAN.md;docs/SCHEMA.md;execution/BIDIRECTIONAL_TASK_GRAPH.csv;logs/CDB085-semantic-api-hashing.log,0,no raw secrets recorded,Added normalized item-row hash reports and fixture proof for private versus public API drift.
2026-07-02T19:44:57Z,CDB086,/home/flexnetos/FlexNetOS/src/nu_plugin-next-worktree,FlexNetOS/nu_plugin,refuse unknown redb store schema versions,crates/codedb_store_redb/src/lib.rs;docs/GAP_CLOSURE_PLAN.md;docs/BIDIRECTIONAL_ARCHITECTURE.md;execution/BIDIRECTIONAL_TASK_GRAPH.csv;logs/CDB086-store-migrations.log,0,no raw secrets recorded,Added UnsupportedSchemaVersion refusal and documented migration/test matrix.
2026-07-02T19:47:15Z,CDB087,/home/flexnetos/FlexNetOS/src/nu_plugin-next-worktree,FlexNetOS/nu_plugin,refuse stale approved plans on source drift,crates/codedb_core/src/lib.rs;docs/GAP_CLOSURE_PLAN.md;docs/CHANGE_PLAN_SCHEMA.md;execution/BIDIRECTIONAL_TASK_GRAPH.csv;logs/CDB087-source-drift-conflicts.log,0,no raw secrets recorded,Added SourceDrift apply-gate refusal and source_drift plan_conflicts row with stale-plan fixture proof.
2026-07-02T19:49:30Z,CDB088,/home/flexnetos/FlexNetOS/src/nu_plugin-next-worktree,FlexNetOS/nu_plugin,record failed materialization and apply recovery rows,crates/codedb_core/src/lib.rs;docs/GAP_CLOSURE_PLAN.md;execution/BIDIRECTIONAL_TASK_GRAPH.csv;logs/CDB088-failed-apply-recovery.log,0,no raw secrets recorded,Added failed apply_attempts and recovered recovery_rows requiring a restored source snapshot match.
2026-07-02T19:51:45Z,CDB089,/home/flexnetos/FlexNetOS/src/nu_plugin-next-worktree,FlexNetOS/nu_plugin,require operator decision provenance in apply gate,crates/codedb_core/src/lib.rs;docs/CHANGE_PLAN_SCHEMA.md;docs/BIDIRECTIONAL_ARCHITECTURE.md;execution/BIDIRECTIONAL_TASK_GRAPH.csv;logs/CDB089-approval-provenance.log,0,no raw secrets recorded,Added decided_at provenance and refused apply gates missing decision id actor timestamp or evidence references.
2026-07-03T01:18:10Z,CDB091,/home/flexnetos/FlexNetOS/src/nu_plugin,nu_plugin,build issue-215 polyglot research and planning package,docs/polyglot-import/README.md;docs/polyglot-import/research-ledger.md;docs/polyglot-import/language-import-surface.md;docs/polyglot-import/polyglot-schema-extension.md;docs/polyglot-import/parser-and-indexer-tooling-matrix.md;docs/polyglot-import/package-manager-and-lockfile-matrix.md;docs/polyglot-import/whole-repo-import-architecture.md;docs/polyglot-import/single-binary-rust-crate-export.md;docs/polyglot-import/proof-and-round-trip-gates.md;docs/polyglot-import/security-and-execution-policy.md;docs/polyglot-import/github-issue-delivery-plan.md;docs/polyglot-import/open-questions.md;prd/nu_plugin_codedb_v1_2_polyglot_import_prd.md,0,no raw secrets recorded,Planning-only documentation package for CDB091-CDB104.
2026-07-03T01:18:10Z,CDB105,/home/flexnetos/FlexNetOS/src/nu_plugin,nu_plugin,update package navigation and handoff surfaces for polyglot planning lane,NAVIGATION.md;NAVIGATION.json;DOC_GRAPH.md;HANDOFF.md;ACCEPTANCE.md;READINESS_GATE.md;STOP_CONDITIONS.md;execution/POLYGLOT_TASK_GRAPH.csv;execution/POLYGLOT_TASK_FILE_MAP.csv;execution/POLYGLOT_GITHUB_ISSUE_DRAFTS.md,0,no raw secrets recorded,Kept V1.1 implementation truth distinct from V1.2 planning status.
2026-07-03T01:18:10Z,CDB105,/home/flexnetos/FlexNetOS/src/nu_plugin,nu_plugin,validate planning package surfaces,execution/POLYGLOT_TASK_GRAPH.csv;execution/POLYGLOT_TASK_FILE_MAP.csv;NAVIGATION.json,0,no raw secrets recorded,"Validated with git diff --check, Python CSV parsing, and JSON parsing."
2026-07-03T01:18:10Z,CDB105,/home/flexnetos/FlexNetOS/src/nu_plugin,nu_plugin,reseal package truth surface after polyglot planning updates,manifests/PACK_MANIFEST.json;manifests/CHECKSUMS.sha256;manifests/PACKAGE_VALIDATION.json,0,no raw secrets recorded,"Ran truth_surface.py --write, --check, and --check-source after planning-package updates."
2026-07-11T20:55:25Z,CDB106,/home/flexnetos/meta/src/nu_plugin,FlexNetOS/nu_plugin,cargo test --workspace --all-features with explicit disposable PostgreSQL 17 DSN,logs/CDB106-mandatory-security-backend-proof-wave.log,0,PostgreSQL DSN omitted and no raw secrets recorded,All Rust tests passed including 13 live PostgreSQL differential migration and rollback tests.
2026-07-11T20:55:25Z,CDB106,/home/flexnetos/meta/src/nu_plugin,FlexNetOS/nu_plugin,nix develop ci dynamic Nu redb and PostgreSQL capture report materialize round trip,logs/CDB106-mandatory-security-backend-proof-wave.log,0,PostgreSQL DSN omitted and no raw secrets recorded,Exact policy-authorized source bytes materialized from both dynamic backends.
2026-07-11T20:55:25Z,CDB106,/home/flexnetos/meta/src/nu_plugin,FlexNetOS/nu_plugin,cargo test workspace and clippy all targets all features,logs/CDB106-mandatory-security-backend-proof-wave.log,0,no raw secrets recorded,Default workspace tests and all-feature warning-deny clippy passed.
2026-07-11T20:55:25Z,CDB106,/home/flexnetos/meta/src/nu_plugin,FlexNetOS/nu_plugin,run every tests/*.nu gate in Nix ci shell,logs/CDB106-mandatory-security-backend-proof-wave.log,0,no raw secrets recorded,All 15 Nu behavior gates passed after the Nix TMPDIR sandbox regression repair.
2026-07-11T20:55:25Z,CDB106,/home/flexnetos/meta/src/nu_plugin,FlexNetOS/nu_plugin,python unittest discovery and executable task graph structure validation,logs/CDB106-mandatory-security-backend-proof-wave.log,0,no raw secrets recorded,67 Python tests plus task graph and proof ledger structure gates passed.
2026-07-11T20:55:25Z,CDB106,/home/flexnetos/meta/src/nu_plugin,FlexNetOS/nu_plugin,python3 scripts/validate_task_graph.py --release,logs/CDB106-mandatory-security-backend-proof-wave.log,1,no raw secrets recorded,Expected release blocker: mandatory graph and proof rows remain incomplete.
2026-07-11T20:55:25Z,CDB106,/home/flexnetos/meta/src/nu_plugin,FlexNetOS/nu_plugin,python3 scripts/validate_requirement_proof_ledger.py --direct-evidence,logs/CDB106-mandatory-security-backend-proof-wave.log,1,no raw secrets recorded,Expected release blocker: 90 partial 50 missing and 140 empty proof artifact inventories remain.
2026-07-12T18:39:05Z,CDB106,/home/flexnetos/meta/src/nu_plugin,FlexNetOS/nu_plugin,run every nu_plugin ledger verification_command (cargo/nu suite); capture per-row receipts,logs/receipts/_command_results.json,0,no raw secrets recorded,31 unique nu_plugin commands green; nix/pg/direct-evidence stay fail-closed as recorded.
2026-07-12T18:39:05Z,REQ-061,/home/flexnetos/meta/src/nu_plugin,FlexNetOS/nu_plugin,cargo test --manifest-path ../envctl/Cargo.toml --workspace; -p envctl-engine; -p envctl,logs/receipts/_command_results.json,0,no raw secrets recorded,envctl workspace 280 tests + engine + cli suites green (`-p engine` corrected to `-p envctl-engine`).
2026-07-12T18:39:05Z,REQ-061,/home/flexnetos/meta/src/nu_plugin,FlexNetOS/nu_plugin,cd ../envctl && bash ci/gates/no-c.sh,logs/receipts/_command_results.json,0,no raw secrets recorded,Corrected cwd for the envctl no-C gate; green; 2 rows.
2026-07-12T18:39:05Z,REQ-061,/home/flexnetos/meta/src/nu_plugin,FlexNetOS/nu_plugin,cargo run ... -p envctl -- db --repo-root ../envctl {symbols|widget refs|scan&&watch|refactor}/db deploy --kind hooks --json,logs/receipts/_command_results.json,0,no raw secrets recorded,"7 db invocations corrected to current CLI contract; all rc=0 with real JSON; flipped REQ-061-CMD04/06/07/09/11, AC04/05."
2026-07-12T18:39:05Z,CDB046,/home/flexnetos/meta/src/nu_plugin,FlexNetOS/nu_plugin,cargo fmt --all --check && cargo clippy --workspace --all-targets --all-features && cargo test --workspace,logs/receipts/_command_results.json,0,no raw secrets recorded,fmt gate fixed workspace-wide; full combo green; flipped to verified/complete.
2026-07-12T18:39:05Z,CDB106-AC09,/home/flexnetos/meta/src/nu_plugin,FlexNetOS/nu_plugin,cargo fmt ... && cargo clippy ... && cargo test --workspace --all-features,logs/receipts/_command_results.json,101,no raw secrets recorded,13 codedb-store-pg parity tests need live PostgreSQL; left partial (pg residual).
2026-07-12T18:39:05Z,CDB077,/home/flexnetos/meta/src/nu_plugin,FlexNetOS/nu_plugin,cargo test -p codedb (embeds BIDIRECTIONAL_TASK_GRAPH.csv; frozen active_task_count==14),logs/receipts/_command_results.json,0,no raw secrets recorded,CDB077-089 commands green but kept active: completing them breaks this frozen codedb bin test (crates/ out of scope).
2026-07-12T18:39:05Z,CDB090,/home/flexnetos/meta/src/nu_plugin,FlexNetOS/nu_plugin,python3 scripts/generate_requirement_proof_receipt.py --all-requirements --output <outside-repo>,logs/receipts/_command_results.json,1,no raw secrets recorded,Refused 'proof checkout is not clean'; detached receipt needs one clean commit (forbidden this session).
2026-07-12T18:39:05Z,CDB106,/home/flexnetos/meta/src/nu_plugin,FlexNetOS/nu_plugin,pytest (4 suites); validate_task_graph.py; validate_requirement_proof_ledger.py; validate_bidirectional_package.py; git diff --check,logs/receipts/_command_results.json,0,no raw secrets recorded,pytest 50/23 subtests; structure PASSED; git diff --check clean; two release validators fail-closed by design.
2026-07-12T18:57:06Z,CDB086,/home/flexnetos/meta/src/nu_plugin,FlexNetOS/nu_plugin,"cargo test -p codedb-store-redb -p codedb-store-pg --features codedb-store-pg/pg-integration (live PG via nix, CODEDB_PG_CONN)",logs/receipts/cdb086-live-pg-stdout.log,0,no raw secrets recorded,rc=0; verified/active (bidirectional row frozen active).
2026-07-12T18:57:06Z,CDB106-AC05,/home/flexnetos/meta/src/nu_plugin,FlexNetOS/nu_plugin,cargo test -p codedb-store-redb -p codedb-store-pg -p codedb --all-features (live PG),logs/receipts/cdb106-ac05-stdout.log,0,no raw secrets recorded,rc=0; verified/complete.
2026-07-12T18:57:06Z,CDB106-AC09,/home/flexnetos/meta/src/nu_plugin,FlexNetOS/nu_plugin,cargo fmt --all --check && cargo clippy --workspace --all-targets --all-features && cargo test --workspace --all-features (live PG),logs/receipts/cdb106-ac09-full-stdout.log,0,no raw secrets recorded,rc=0 (245/0 all-feature tests); verified/complete.
2026-07-12T21:03:01Z,CDB068,/home/flexnetos/meta/src/nu_plugin,FlexNetOS/nu_plugin,add fail-closed task-control regression tests and run focused red/green loop,logs/CDB068-csv-source-of-truth-repair.log,0,no raw secrets recorded,Four focused tests failed before implementation and all 15 task-graph validator tests passed after the repair.
2026-07-12T21:03:01Z,CDB068,/home/flexnetos/meta/src/nu_plugin,FlexNetOS/nu_plugin,normalize task graph evidence state remove ephemeral paths repair command CSV and regenerate Markdown projection,logs/CDB068-csv-source-of-truth-repair.log,0,no raw secrets recorded,Structure validation passes; 66 complete rows bind evidence_files_present; 4 planned rows remain pending; command ledger has 60 valid records.
2026-07-12T21:05:37Z,CDB074,/home/flexnetos/meta/src/nu_plugin,FlexNetOS/nu_plugin,add reserved collision-free codedb-core fixture allocator and stress parallel lib tests 50 times,logs/CDB074-isolated-worktree-patches.log,0,no raw secrets recorded,RED concurrency test reproduced 24 duplicate roots; GREEN 1250 tests passed across 50 default-parallel runs.
2026-07-12T21:13:36Z,CDB078,/home/flexnetos/meta/src/nu_plugin,FlexNetOS/nu_plugin,add hostile proc-macro log symlink regression and run codedb-build-capture tests,logs/CDB078-proc-macro-gate.log,0,no raw secrets recorded,RED proved outside-file overwrite; GREEN 40 unit tests and 2 compile-fail doctests passed; task remains active pending production frontdoor.
2026-07-12T21:19:47Z,CDB078,/home/flexnetos/meta/src/nu_plugin,FlexNetOS/nu_plugin,prove external unsafe frontdoor fabrication then make dynamic entry symbols crate-private,logs/CDB078-proc-macro-gate.log,0,no raw secrets recorded,RED compile-fail example compiled; GREEN 40 unit tests and 3 compile-fail doctests passed; public library remains refusal-only.
2026-07-12T21:25:33Z,CDB013,/home/flexnetos/meta/src/nu_plugin,FlexNetOS/nu_plugin,python3 -m unittest tests.test_workspace_manifest and cargo metadata --format-version 1 --no-deps,logs/CDB013-workspace.log,0,no raw secrets recorded,Three direct tests and exact eleven-member Cargo metadata parity passed.
2026-07-12T21:25:33Z,CDB040,/home/flexnetos/meta/src/nu_plugin,FlexNetOS/nu_plugin,python3 -m unittest tests.test_integration_contracts and python3 scripts/validate_integration_contracts.py,logs/CDB040-tooling.log,0,no raw secrets recorded,Nine positive and negative tests plus the live integration contract validator passed.
